{
  "$schema": "http://json-schema.org/draft-07/schema#",
  "$id": "https://github.com/ian-klopper/constellation/roadmap.schema.json",
  "title": "Constellation roadmap",
  "description": "Schema for the project tracker at roadmap.json. Edits to roadmap.json must conform to this contract. additionalProperties:false everywhere — do not invent new fields; update this schema in the same commit if a new shape is genuinely needed.",
  "type": "object",
  "additionalProperties": false,
  "required": [
    "right_now",
    "short_term",
    "mid_term",
    "long_term",
    "recently_shipped",
    "known_issues",
    "open_questions",
    "anti_goals",
    "parked_ideas"
  ],
  "properties": {
    "$schema": {
      "type": "string",
      "description": "Pointer to this schema file. Keep as './roadmap.schema.json' so editors auto-validate."
    },
    "right_now": {
      "type": "string",
      "maxLength": 280,
      "description": "One sentence on what you're actively working on this session. Re-read when you sit down. Keep it short — replace it when you switch tasks."
    },
    "short_term": {
      "type": "array",
      "description": "Goals you'd ship in the next few days if nothing else came up.",
      "items": { "$ref": "#/definitions/GoalItem" }
    },
    "mid_term": {
      "type": "array",
      "description": "Bigger bets that aren't urgent but you want to land soon (next few weeks).",
      "items": { "$ref": "#/definitions/GoalItem" }
    },
    "long_term": {
      "type": "array",
      "description": "Where Constellation is going. May take months.",
      "items": { "$ref": "#/definitions/GoalItem" }
    },
    "recently_shipped": {
      "type": "array",
      "description": "What just shipped. Prune items older than ~2 weeks — git log remembers.",
      "items": { "$ref": "#/definitions/ShippedItem" }
    },
    "known_issues": {
      "type": "array",
      "description": "Bugs or rough edges you've noticed but aren't fixing right now. Visible so they don't get forgotten.",
      "items": { "$ref": "#/definitions/IdeaItem" }
    },
    "open_questions": {
      "type": "array",
      "description": "Decisions you want to think through before committing.",
      "items": { "$ref": "#/definitions/IdeaItem" }
    },
    "anti_goals": {
      "type": "array",
      "description": "Things explicitly out of scope. Helps say 'no' to scope creep.",
      "items": { "$ref": "#/definitions/IdeaItem" }
    },
    "parked_ideas": {
      "type": "array",
      "description": "Ideas you've thought of but aren't goals yet. A graveyard so you can let go without forgetting.",
      "items": { "$ref": "#/definitions/IdeaItem" }
    }
  },
  "definitions": {
    "GoalItem": {
      "type": "object",
      "additionalProperties": false,
      "required": ["id", "title", "status"],
      "properties": {
        "id": {
          "type": "string",
          "pattern": "^[a-z0-9-]+$",
          "minLength": 1,
          "maxLength": 60,
          "description": "Stable kebab-case identifier, unique within the section. Lowercase letters, digits, and hyphens only."
        },
        "title": {
          "type": "string",
          "minLength": 1,
          "maxLength": 200,
          "description": "Short imperative phrase describing the goal."
        },
        "status": {
          "type": "string",
          "enum": ["queued", "in_progress", "blocked"],
          "description": "queued = not started; in_progress = actively working; blocked = waiting on something. Closed enum — do not invent new values."
        },
        "notes": {
          "type": "string",
          "description": "Optional context — why this matters, what's tricky, what to watch out for."
        },
        "files": {
          "type": "array",
          "items": { "type": "string" },
          "description": "Optional list of repo-relative paths most relevant to this goal."
        },
        "plan": {
          "type": "string",
          "description": "Optional path to a plan doc, e.g. 'docs/plans/2026-05-03-...md'."
        }
      }
    },
    "ShippedItem": {
      "type": "object",
      "additionalProperties": false,
      "required": ["id", "title", "shipped_at"],
      "properties": {
        "id": {
          "type": "string",
          "pattern": "^[a-z0-9-]+$",
          "minLength": 1,
          "maxLength": 60
        },
        "title": {
          "type": "string",
          "minLength": 1,
          "maxLength": 200
        },
        "shipped_at": {
          "type": "string",
          "pattern": "^\\d{4}-\\d{2}-\\d{2}$",
          "description": "ISO date (YYYY-MM-DD) when this shipped."
        },
        "commit": {
          "type": "string",
          "pattern": "^[a-f0-9]{7,40}$",
          "description": "Optional short commit SHA (7–40 hex chars)."
        },
        "notes": {
          "type": "string"
        }
      }
    },
    "IdeaItem": {
      "type": "object",
      "additionalProperties": false,
      "required": ["title"],
      "properties": {
        "title": {
          "type": "string",
          "minLength": 1,
          "maxLength": 200
        },
        "notes": {
          "type": "string"
        }
      }
    }
  }
}
